ticket,reply,content_score,content_explanation,format_score,format_explanation
"Hi, I'd like to check the shipping status of my order #1234.","Sure, you can check your shipping status on our website. Your package is scheduled for delivery tomorrow.",4,"The response is mostly relevant and accurate as it provides the delivery status, which is the main point of the customer's inquiry. However, it assumes the customer will know how to find the status on the website without providing specific guidance or a link, which slightly reduces completeness.",5,"The response is clear and well-structured, with no grammatical or spelling errors. The information is presented concisely and understandably."
"The product I received is defective. I'd like a refund, please.",We're sorry to hear that. Could you please provide a photo of the defect so we can proceed with the return process?,3,"The response is somewhat relevant as it initiates the process for a refund by asking for a photo, which is a typical request for verifying the defect. However, it does not directly address the customer's refund request or provide clarity on the refund process. More information on further steps after providing the photo would enhance completeness.",4,"The response is clear and concise, making it easy to understand. It is well-structured, first expressing empathy and then requesting necessary information. There are no grammatical or spelling mistakes, but a slightly more detailed structure could improve organization."
I have a question about how to set up my new device. The instructions are not clear.,"Hello, thanks for contacting us. Please go to Settings > Advanced > Device Setup, and follow the steps. Let me know if you need further help.",3,"The AI response is partially relevant as it attempts to guide the customer to set up the device by providing a navigation path. However, it may not completely answer the customer’s problem if additional information is needed beyond a simple navigation path. The accuracy in terms of the path given is assumed correct, but completeness is lacking as it does not address potential variations or provide troubleshooting if the steps are unclear.",4,"The response is clear and easy to understand, with no grammar or spelling errors. The structure is straightforward, presenting an action path and an offer for further assistance. However, the structure could be improved by introducing steps or further breakdowns to enhance user understanding."
"Hello, my account was charged twice. Could you help me fix that?",We've identified the issue and have requested a refund for the second charge. You should see the funds returned within 5-7 business days.,4,"The response is relevant, as it addresses the issue of the duplicate charge. The information about the refund process is accurate, and the completion timeline for the refund is provided. However, it lacks some details, such as an apology for the inconvenience and a reference number for tracking the refund request, which would have made it more comprehensive.",5,"The response is clear and concise, with a straightforward explanation of the next steps. The structure is logical, and there are no grammar or spelling mistakes, making it easy to understand."
I can't log into my account. It says 'invalid password' even though I'm sure it's correct.,Please reset your password using the 'Forgot Password' link. Let us know if you still encounter issues afterwards.,4,"The response is relevant and accurate as it advises the customer to reset their password, which is a practical first step. However, it lacks completeness as it doesn't address why the issue might have occurred or provide reassurance about security and potential causes.",5,"The response is clear, well-structured, and free from grammatical or spelling errors. It succinctly conveys the necessary advice to the customer."
